title,subtitle,status,startDate,endDate,endHour,startHour,maxPeople,description,highlighted,observations,ticketsPerUser,creator,ticketInfo,picturesUrls,sublocationIds,ticketCategoryTitle|ticketCategorySubtitle|ticketCategoryPrice|ticketCategoryDescription|ticketCategoryMax|ticketCategoryAvailable,
Star Wars Party,Themed Party,true,2019-09-17,2019-09-17,23:30,18:30,200,Nerdiest party in Cluj,true,Best costume wins free drinks,5,creator,You can buy tickets exclusively online and we have a no return policy!,https://event-management-pictures.s3-eu-west-1.amazonaws.com/image-88200-1597822468303-pizza.jpg;,1;,VIP|best|50.0|really good|5|true;OK|ok|40.0|kind of ok|10|true;
msg Party,Intern Party,false,2020-09-03,2020-09-15,23:30,20:30,50,Boom schakalaka,true,BYOB,50,creator,Best choices for your fun time!,https://event-management-pictures.s3-eu-west-1.amazonaws.com/image-142400-1598019891841-typescript_print.png;https://event-management-pictures.s3-eu-west-1.amazonaws.com/image-85790-1597922834259-despicable_me_2_minions_wallpaper1_96776.jpg;https://event-management-pictures.s3-eu-west-1.amazonaws.com/image-71686-1597835305734-untold.jpg;,2;,VIP|best|50.0|really good|17|true;Medium|not so good|100.0|for you|17|true;Cheap|good deal|10.0|really good|16|true;
Chess Club Meeting,For Chess Lovers,true,2020-06-17,2020-06-17,16:30,12:30,40,Feel free to join,true,New competition will be announced,15,creator,For every 2 tickets bought you get one for free!,https://event-management-pictures.s3-eu-west-1.amazonaws.com/image-142400-1598019891841-typescript_print.png;,5;,
Boc Party,Election Winning Party,true,2020-11-17,2020-11-17,23:30,18:30,500,Free subway sandwiches,true,All are welcome,8,creator,You can't miss these ones!,https://event-management-pictures.s3-eu-west-1.amazonaws.com/image-135725-1597848333216-tr30-June-Ibiza.jpg;,1;,
UBB vs UTCN contest,Hackathon,true,2021-09-17,2021-09-17,23:30,09:30,120,No python please,true,Free pizza for everyone,5,creator,Best deal offer!,https://event-management-pictures.s3-eu-west-1.amazonaws.com/image-135725-1597848333216-tr30-June-Ibiza.jpg;,3;,
Most sarmale ever made,Breaking records,true,2021-09-20,2021-09-20,23:30,08:30,200,Breaking the record for most cabbage rolls made,true,Bring your friends and eat for free,12,creator,Tickets can also be bought from out partners and on www.ticketsforsale.com,https://event-management-pictures.s3-eu-west-1.amazonaws.com/image-257420-1597822468246-MicrosoftTeams-image.png;,2;,
Fruit Party,Nothing but fruits, for real,false,2019-09-17,2019-09-17,23:30,18:30,200,Healthiest party in Cluj,true,NO MEAT!!!,2,creator,You can buy tickets exclusively online and we have a no return policy!,https://event-management-pictures.s3-eu-west-1.amazonaws.com/image-71686-1597835305734-untold.jpg;https://event-management-pictures.s3-eu-west-1.amazonaws.com/image-85790-1597922834259-despicable_me_2_minions_wallpaper1_96776.jpg;,4;,
Star Trek Party,Themed Party,true,2020-12-17,2020-12-17,23:30,18:30,200,Nerdiest party in Cluj 2,true,Best costume wins free drinks,5,creator,You get now 15% off for every ticket category if you buy 2 or more tickets!,https://event-management-pictures.s3-eu-west-1.amazonaws.com/image-85790-1597922834259-despicable_me_2_minions_wallpaper1_96776.jpg;,2;,
